{
  "documentType": "clover-core-portfolio-projection",
  "schemaVersion": "2.0.0",
  "status": "candidate-unmerged-undeployed",
  "sourceRegistry": {
    "path": "portfolio/registry/versions/2.0.0/registry.json",
    "schemaVersion": "2.0.0"
  },
  "architecture": {
    "pattern": "federated-kernel-sovereign-cells",
    "kernelProjectId": "clover-core",
    "ownerWindowProjectId": "cloverapps-ai",
    "contextGatewayProjectId": "clover-context-gateway",
    "knowledgeSubsystemProjectId": "knowledge-hub-window-vault",
    "rawCellDataStoredInKernel": false
  },
  "projectionPolicy": {
    "minimumNecessary": true,
    "rawCellDataIncluded": false,
    "unknownsPreserved": true
  },
  "projects": [
    {
      "projectId": "akia-ica",
      "title": "Akia / ICA",
      "classification": "external",
      "lifecycle": "external-current",
      "architectureRole": "external-source",
      "verificationStatus": "unverified",
      "sourceOfTruthStatus": "reported",
      "rawCellDataStoredInCore": false,
      "projectionBoundary": {
        "allowed": [
          "authorized delivery/consent health and minimized exception signals"
        ],
        "excluded": [
          "message bodies, guest contacts, and credentials"
        ]
      },
      "relationships": [
        {
          "type": "source-for",
          "targetProjectId": "propertycare-booking-central",
          "status": "reported"
        }
      ],
      "identitySummary": [
        {
          "identityId": "external-current",
          "role": "external-current",
          "release": {
            "status": "unknown",
            "value": null
          },
          "sitesSave": {
            "status": "not-applicable",
            "value": null
          },
          "commit": {
            "status": "not-applicable",
            "value": null
          },
          "pullRequest": {
            "status": "not-applicable",
            "value": null
          },
          "deployment": {
            "status": "external-current",
            "value": null
          },
          "dataSchema": {
            "status": "unknown",
            "value": null
          },
          "backup": {
            "status": "not-applicable",
            "value": null
          },
          "verification": {
            "status": "unverified",
            "value": null
          },
          "rollback": {
            "status": "not-applicable",
            "value": null
          }
        }
      ],
      "unknowns": [
        "Connector, consent, coverage, version, and authentication health"
      ],
      "nextMilestone": "Define consent-preserving draft/approval and delivery receipts before automation."
    },
    {
      "projectId": "ambient-ai-workflow",
      "title": "Ambient AI Workflow / Captain's Log",
      "classification": "concept",
      "lifecycle": "concept",
      "architectureRole": "concept",
      "verificationStatus": "unverified",
      "sourceOfTruthStatus": "not-applicable",
      "rawCellDataStoredInCore": false,
      "projectionBoundary": {
        "allowed": [
          "candidate observations after explicit promotion"
        ],
        "excluded": [
          "always-on raw audio and uncontrolled transcript retention"
        ]
      },
      "relationships": [
        {
          "type": "overlaps-with",
          "targetProjectId": "clover-companion",
          "status": "reported"
        }
      ],
      "identitySummary": [
        {
          "identityId": "unversioned-concept",
          "role": "planning",
          "release": {
            "status": "unknown",
            "value": null
          },
          "sitesSave": {
            "status": "not-applicable",
            "value": null
          },
          "commit": {
            "status": "not-applicable",
            "value": null
          },
          "pullRequest": {
            "status": "not-applicable",
            "value": null
          },
          "deployment": {
            "status": "not-applicable",
            "value": null
          },
          "dataSchema": {
            "status": "not-applicable",
            "value": null
          },
          "backup": {
            "status": "not-applicable",
            "value": null
          },
          "verification": {
            "status": "unverified",
            "value": null
          },
          "rollback": {
            "status": "not-applicable",
            "value": null
          }
        }
      ],
      "unknowns": [
        "Whether it should remain distinct",
        "Capture, privacy, and retention design"
      ],
      "nextMilestone": "Define the smallest read-only capture and daily-summary loop."
    },
    {
      "projectId": "boat-rentals",
      "title": "Serenity Shores Boat Rentals",
      "classification": "application",
      "lifecycle": "active-runtime",
      "architectureRole": "cell",
      "verificationStatus": "partially-verified",
      "sourceOfTruthStatus": "verified",
      "rawCellDataStoredInCore": false,
      "projectionBoundary": {
        "allowed": [
          "booking reference, workflow status, storage health, waiver version, tasks, and sanitized incidents"
        ],
        "excluded": [
          "signatures, identity evidence, agreement bodies, images, access codes, and detailed incidents"
        ]
      },
      "relationships": [
        {
          "type": "cell-of",
          "targetProjectId": "clover-core",
          "status": "verified"
        }
      ],
      "identitySummary": [
        {
          "identityId": "production-v2",
          "role": "production",
          "release": {
            "status": "reported",
            "value": "v2 operational release"
          },
          "sitesSave": {
            "status": "not-applicable",
            "value": null
          },
          "commit": {
            "status": "partially-verified",
            "value": null
          },
          "pullRequest": {
            "status": "not-applicable",
            "value": null
          },
          "deployment": {
            "status": "verified",
            "value": "production"
          },
          "dataSchema": {
            "status": "unknown",
            "value": null
          },
          "backup": {
            "status": "unknown",
            "value": null
          },
          "verification": {
            "status": "partially-verified",
            "value": "production present; semantic/source pairing incomplete"
          },
          "rollback": {
            "status": "unknown",
            "value": null
          }
        },
        {
          "identityId": "security-storage-pr1",
          "role": "candidate",
          "release": {
            "status": "candidate-unvalidated",
            "value": "security and storage candidate"
          },
          "sitesSave": {
            "status": "not-applicable",
            "value": null
          },
          "commit": {
            "status": "partially-verified",
            "value": null
          },
          "pullRequest": {
            "status": "verified",
            "value": "chrisdortch/serenity-shores-boat-rentals#1"
          },
          "deployment": {
            "status": "candidate-unvalidated",
            "value": "fail-closed preview"
          },
          "dataSchema": {
            "status": "candidate-unvalidated",
            "value": "candidate storage contract"
          },
          "backup": {
            "status": "candidate-unvalidated",
            "value": null
          },
          "verification": {
            "status": "candidate-unvalidated",
            "value": null
          },
          "rollback": {
            "status": "verified",
            "value": "production main"
          }
        },
        {
          "identityId": "data-protocol-rehearsal",
          "role": "rehearsal",
          "release": {
            "status": "not-applicable",
            "value": null
          },
          "sitesSave": {
            "status": "not-applicable",
            "value": null
          },
          "commit": {
            "status": "partially-verified",
            "value": null
          },
          "pullRequest": {
            "status": "unknown",
            "value": null
          },
          "deployment": {
            "status": "verified",
            "value": "separate Data Protocol preview"
          },
          "dataSchema": {
            "status": "not-applicable",
            "value": null
          },
          "backup": {
            "status": "not-applicable",
            "value": null
          },
          "verification": {
            "status": "verified",
            "value": "protocol rehearsal only"
          },
          "rollback": {
            "status": "not-applicable",
            "value": null
          }
        }
      ],
      "unknowns": [
        "Exact production commit",
        "Production data-schema and backup anchors",
        "Exact candidate preview configuration"
      ],
      "nextMilestone": "Rerun the exact-head synthetic harness with preview-only configuration and preserve production separation."
    },
    {
      "projectId": "bookingcentral",
      "title": "BookingCentral",
      "classification": "external",
      "lifecycle": "external-current",
      "architectureRole": "external-source",
      "verificationStatus": "unverified",
      "sourceOfTruthStatus": "reported",
      "rawCellDataStoredInCore": false,
      "projectionBoundary": {
        "allowed": [
          "authorized minimized booking coverage and exception signals"
        ],
        "excluded": [
          "wholesale rental, waiver, guest, and access records"
        ]
      },
      "relationships": [
        {
          "type": "source-for",
          "targetProjectId": "propertycare-booking-central",
          "status": "reported"
        }
      ],
      "identitySummary": [
        {